{
  "version": "V1.0",
  "correlationId": "551485a3-001d-91e8-060e-890c40505bd7",
  "accountNumber": "1100000186762",
  "availableWithdrawal": "2.00",
  "accountBalance": "2.00",
  "accountClosedFlag": "",
  "accountBlockingCode": "00",
  "accountBlockingReasonCode": "00",
  "currentInvestmentMonth": {
    "investmentRemaining": "6.00",
    "investmentLimit": "50.00",
    "endDate": "2018-04-30"
  },
  "clientForename": "Neil",
  "clientSurname": "Harasstone",
  "dateOfBirth": "1999-07-10",
  "addressLine1": "32 Braeside Crescent",
  "addressLine2": "Auchenback",
  "addressLine3": "Barrhead",
  "addressLine4": "Glasgow",
  "addressLine5": " ",
  "postcode": "G78 2QG",
  "countryCode": "GB",
  "emailAddress": " tony.owens@atos.net",
  "commsPreference": "00",
  "clientBlockingCode": "00",
  "clientBlockingReasonCode": "00",
  "clientCancellationStatus": "",
  "nbaAccountNumber": "44444444",
  "nbaPayee": "Mr N Harasstone",
  "nbaRollNumber": "A1234567AAA",
  "nbaSortCode": "202020",
  "terms": [
    {
      "termNumber": 2,
      "startDate": "2020-03-01",
      "endDate": "2022-02-28",
      "maxBalance": "0.00",
      "bonusEstimate": "0.00",
      "bonusPaid": "0.00"
    },
    {
      "termNumber": 1,
      "startDate": "2018-03-01",
      "endDate": "2020-02-29",
      "maxBalance": "42.00",
      "bonusEstimate": "21.00",
      "bonusPaid": "0.00"
    }
  ]
}