{
  "version": "V1.0",
  "correlationId": "551485a3-001d-91e8-060e-890c40505bd7",
  "accountNumber": "1100000114754",
  "availableWithdrawal": "45.12",
  "accountBalance": "45.12",
  "accountClosedFlag": "",
  "accountBlockingCode": "00",
  "accountBlockingReasonCode": "00",
  "currentInvestmentMonth": {
    "investmentRemaining": "43.00",
    "investmentLimit": "50.00",
    "endDate": "2018-04-30"
  },
  "clientForename": "Harry",
  "clientSurname": "Batey",
  "dateOfBirth": "1991-07-07",
  "addressLine1": "32 Braeside Crescent",
  "addressLine2": "Barrhead",
  "addressLine3": "Glasgow",
  "addressLine4": " ",
  "addressLine5": " ",
  "postcode": "G78 2QG",
  "countryCode": "GB",
  "emailAddress": "jim.carslaw@atos.net",
  "commsPreference": "02",
  "clientBlockingCode": "00",
  "clientBlockingReasonCode": "00",
  "clientCancellationStatus": "",
  "nbaAccountNumber": "11111111",
  "nbaPayee": "Mr Harry Batey",
  "nbaSortCode": "801497",
  "terms": [
    {
      "termNumber": 1,
      "startDate": "2017-12-01",
      "endDate": "2019-11-30",
      "maxBalance": "53.92",
      "bonusEstimate": "26.96",
      "bonusPaid": "0.00"
    },
    {
      "termNumber": 2,
      "startDate": "2019-12-01",
      "endDate": "2021-11-30",
      "maxBalance": "0.00",
      "bonusEstimate": "0.00",
      "bonusPaid": "0.00"
    }
  ]
}