{
  "version": "V1.0",
  "correlationId": "551485a3-001d-91e8-060e-890c40505bd7",
  "accountNumber": "1100000184743",
  "availableWithdrawal": "0.00",
  "accountBalance": "0.00",
  "accountClosedFlag": "C",
  "accountClosureDate": "2018-04-09",
  "accountClosingBalance": "10.00",
  "accountBlockingCode": "00",
  "accountBlockingReasonCode": "00",
  "currentInvestmentMonth":    {
    "investmentRemaining": "50.00",
    "investmentLimit": "50.00",
    "endDate": "2018-04-30"
  },
  "clientForename": "Georgina",
  "clientSurname": "Bater",
  "dateOfBirth": "1998-06-28",
  "addressLine1": "32 Braeside Crescent",
  "addressLine2": "Auchenback",
  "addressLine3": "Barrhead",
  "addressLine4": "Glasgow",
  "addressLine5": " ",
  "postcode": "G78 2QG",
  "countryCode": "GB",
  "emailAddress": " tony.owens@atos.net",
  "commsPreference": "02",
  "clientBlockingCode": "00",
  "clientBlockingReasonCode": "00",
  "clientCancellationStatus": "",
  "nbaAccountNumber": "11111111",
  "nbaPayee": "D Wood updated before closing",
  "nbaSortCode": "801497",
  "terms":    [
    {
      "termNumber": 1,
      "startDate": "2018-03-01",
      "endDate": "2020-02-29",
      "maxBalance": "15.00",
      "bonusEstimate": "7.50",
      "bonusPaid": "0.00"
    },
    {
      "termNumber": 2,
      "startDate": "2020-03-01",
      "endDate": "2022-02-28",
      "maxBalance": "0.00",
      "bonusEstimate": "0.00",
      "bonusPaid": "0.00"
    }
  ]
}