{
  "version": "V1.0",
  "correlationId": "8b32cbca-9ad9-4ba4-a7a8-9f868fb7c4b4",
  "accountNumber": "1400000000206",
  "availableWithdrawal": "1350.00",
  "accountBalance": "1350.00",
  "accountClosedFlag": "",
  "accountBlockingCode": "00",
  "accountBlockingReasonCode": "00",
  "currentInvestmentMonth": {
    "investmentRemaining": "50.00",
    "investmentLimit": "50.00",
    "endDate": "2018-04-30"
  },
  "clientForename": "Warick",
  "clientSurname": "Willow",
  "dateOfBirth": "1994-10-19",
  "addressLine1": "99 Condor Grove",
  "addressLine2": "Blackpool",
  "addressLine3": " ",
  "addressLine4": " ",
  "addressLine5": " ",
  "postcode": "FY1 5QY",
  "countryCode": "GB",
  "emailAddress": "robert.ure@atos.net",
  "commsPreference": "02",
  "clientBlockingCode": "00",
  "clientBlockingReasonCode": "00",
  "clientCancellationStatus": "",
  "nbaAccountNumber": "12345678",
  "nbaPayee": "Warick Willow",
  "nbaSortCode": "873748",
  "terms": [
    {
      "termNumber": 1,
      "startDate": "2017-10-01",
      "endDate": "2019-09-30",
      "maxBalance": "1200.00",
      "bonusEstimate": "600.00",
      "bonusPaid": "600.00"
    },
    {
      "termNumber": 2,
      "startDate": "2019-10-01",
      "endDate": "2021-09-30",
      "maxBalance": "1350.00",
      "bonusEstimate": "75.00",
      "bonusPaid": "0.00"
    }
  ]
}